{
    "$schema": "https://json-schema.org/draft/2020-12/schema",
    "$id": "https://github.com/rmyndharis/aimhooman/schemas/rule-pack.schema.json",
    "title": "aimhooman local rule pack",
    "description": "Structural schema for local packs. The loader also applies the documented content-expression and path-glob work limits.",
    "type": "array",
    "items": {
        "type": "object",
        "required": ["id", "provider", "category", "kind", "match", "actions", "reason"],
        "properties": {
            "id": { "type": "string", "minLength": 1 },
            "version": { "type": "integer", "minimum": 1 },
            "provider": { "type": "string", "minLength": 1 },
            "category": { "type": "string", "minLength": 1 },
            "confidence": { "type": "string", "minLength": 1 },
            "kind": { "enum": ["path", "message", "code"] },
            "match": {
                "type": "object",
                "properties": {
                    "paths": { "$ref": "#/$defs/nonEmptyStrings" },
                    "except": { "$ref": "#/$defs/strings" },
                    "content": { "$ref": "#/$defs/nonEmptyStrings" },
                    "path_case": { "enum": ["sensitive", "insensitive"] }
                },
                "additionalProperties": false
            },
            "actions": {
                "type": "object",
                "properties": {
                    "clean": { "$ref": "#/$defs/action" },
                    "strict": { "$ref": "#/$defs/action" },
                    "compliance": { "$ref": "#/$defs/action" }
                },
                "minProperties": 1,
                "additionalProperties": false
            },
            "reason": { "type": "string", "minLength": 1 },
            "remediation": { "$ref": "#/$defs/strings" },
            "references": { "$ref": "#/$defs/strings" }
        },
        "allOf": [
            {
                "if": { "properties": { "kind": { "const": "path" } }, "required": ["kind"] },
                "then": {
                    "properties": {
                        "match": {
                            "type": "object",
                            "properties": {
                                "paths": true,
                                "content": true,
                                "path_case": true
                            },
                            "required": ["paths"],
                            "not": {
                                "type": "object",
                                "properties": { "content": true },
                                "required": ["content"]
                            }
                        }
                    }
                }
            },
            {
                "if": { "properties": { "kind": { "const": "message" } }, "required": ["kind"] },
                "then": {
                    "properties": {
                        "match": {
                            "type": "object",
                            "properties": {
                                "content": true,
                                "paths": true,
                                "except": true,
                                "path_case": true
                            },
                            "required": ["content"],
                            "not": {
                                "anyOf": [
                                    {
                                        "type": "object",
                                        "properties": { "paths": true },
                                        "required": ["paths"]
                                    },
                                    {
                                        "type": "object",
                                        "properties": { "except": true },
                                        "required": ["except"]
                                    },
                                    {
                                        "type": "object",
                                        "properties": { "path_case": true },
                                        "required": ["path_case"]
                                    }
                                ]
                            }
                        }
                    }
                }
            },
            {
                "if": { "properties": { "kind": { "const": "code" } }, "required": ["kind"] },
                "then": {
                    "properties": {
                        "match": {
                            "type": "object",
                            "properties": { "content": true },
                            "required": ["content"]
                        }
                    }
                }
            }
        ],
        "additionalProperties": false
    },
    "$defs": {
        "action": { "enum": ["allow", "review", "block"] },
        "strings": {
            "type": "array",
            "items": { "type": "string", "minLength": 1 }
        },
        "nonEmptyStrings": {
            "type": "array",
            "minItems": 1,
            "items": { "type": "string", "minLength": 1 }
        }
    }
}
