[
    {
        "id": "marker.corner-cut",
        "version": 3,
        "provider": "generic",
        "category": "ai-marker",
        "confidence": "medium",
        "kind": "code",
        "match": {
            "paths": [
                "**/*"
            ],
            "except": [
                "**/docs/**",
                "**/test/**",
                "**/tests/**",
                "**/__tests__/**",
                "**/testdata/**",
                "**/fixtures/**",
                "**/__fixtures__/**",
                "**/vendor/**",
                "**/vendored/**",
                "**/third_party/**",
                "**/node_modules/**",
                "**/dist/**",
                "**/build/**",
                "out/**",
                "target/**",
                "**/.next/**",
                "**/coverage/**",
                "**/generated/**",
                "**/*.generated.*",
                "**/*.min.js",
                "**/*.map",
                "**/*.md",
                "**/*.mdx",
                "**/*.markdown",
                "**/*.rst",
                "**/*.test.*",
                "**/*.spec.*",
                "**/*_test.*",
                "**/*_spec.*"
            ],
            "content": [
                "(?i)\\b(ponytail|caveman|yagni-oneliner):"
            ]
        },
        "actions": {
            "clean": "review",
            "strict": "block",
            "compliance": "review"
        },
        "reason": "AI-tooling corner-cut marker left in committed code.",
        "remediation": [
            "Resolve the shortcut it names, or remove the marker before committing."
        ]
    },
    {
        "id": "marker.ai-authored",
        "version": 2,
        "provider": "generic",
        "category": "ai-marker",
        "confidence": "low",
        "kind": "code",
        "match": {
            "paths": [
                "**/*"
            ],
            "except": [
                "**/docs/**",
                "**/test/**",
                "**/tests/**",
                "**/__tests__/**",
                "**/testdata/**",
                "**/fixtures/**",
                "**/__fixtures__/**",
                "**/vendor/**",
                "**/vendored/**",
                "**/third_party/**",
                "**/node_modules/**",
                "**/dist/**",
                "**/build/**",
                "out/**",
                "target/**",
                "**/.next/**",
                "**/coverage/**",
                "**/generated/**",
                "**/*.generated.*",
                "**/*.min.js",
                "**/*.map",
                "**/*.md",
                "**/*.mdx",
                "**/*.markdown",
                "**/*.rst",
                "**/*.test.*",
                "**/*.spec.*",
                "**/*_test.*",
                "**/*_spec.*"
            ],
            "content": [
                "(?i)\\b(generated by (ai|copilot|claude|chatgpt|codex))\\b"
            ]
        },
        "actions": {
            "clean": "review",
            "strict": "block",
            "compliance": "review"
        },
        "reason": "AI-authored code marker left in committed code.",
        "remediation": [
            "Remove the marker comment if the code is human-owned."
        ]
    }
]
