[
    {
        "id": "secret.private-key-content",
        "version": 1,
        "provider": "generic",
        "category": "secret",
        "confidence": "high",
        "kind": "code",
        "match": {
            "content": [
                "-----BEGIN (?:ENCRYPTED |RSA |DSA |EC |OPENSSH |PGP )?PRIVATE KEY(?: BLOCK)?-----"
            ]
        },
        "actions": {
            "clean": "block",
            "strict": "block",
            "compliance": "block"
        },
        "reason": "Private-key material must not enter Git history.",
        "remediation": [
            "Remove the key from the index, rotate it if exposed, and store it outside the repository."
        ]
    },
    {
        "id": "secret.service-account-key",
        "version": 1,
        "provider": "generic",
        "category": "secret",
        "confidence": "high",
        "kind": "code",
        "match": {
            "content": [
                "(?i)\\\"private_key\\\"\\s*:\\s*\\\"-----BEGIN (?:RSA )?PRIVATE KEY-----"
            ]
        },
        "actions": {
            "clean": "block",
            "strict": "block",
            "compliance": "block"
        },
        "reason": "A service-account credential must not enter Git history.",
        "remediation": [
            "Remove the credential from the index, rotate it if exposed, and use the service's secret store."
        ]
    },
    {
        "id": "secret.aws-key-content",
        "version": 2,
        "provider": "aws",
        "category": "secret",
        "confidence": "high",
        "kind": "code",
        "match": {
            "content": [
                "(?i)\\baws_(?:secret_access_key|session_token)\\b\\s*[:=]\\s*[\\\"']?[A-Za-z0-9/+=]{32,}(?![A-Za-z0-9/+=])",
                "\\b(?:AKIA|ASIA)[A-Z0-9]{16}\\b"
            ]
        },
        "actions": {
            "clean": "block",
            "strict": "block",
            "compliance": "block"
        },
        "reason": "AWS credential material must not enter Git history.",
        "remediation": [
            "Remove the credential from the index, rotate it if exposed, and use an AWS credential provider."
        ]
    },
    {
        "id": "secret.provider-token",
        "version": 1,
        "provider": "generic",
        "category": "secret",
        "confidence": "high",
        "kind": "code",
        "match": {
            "content": [
                "\\b(?:gh[pousr]_[A-Za-z0-9]{36,255}|github_pat_[A-Za-z0-9_]{60,255}|glpat-[A-Za-z0-9_-]{20,255}|npm_[A-Za-z0-9]{36,255}|xox[baprs]-[A-Za-z0-9-]{20,255})\\b",
                "\\b(?:sk-ant-api[0-9]{2}-[A-Za-z0-9_-]{80,255}|sk-proj-[A-Za-z0-9_-]{40,255}|AIza[A-Za-z0-9_-]{35}|(?:sk|rk)_live_[A-Za-z0-9]{20,255}|hf_[A-Za-z0-9]{34}|SG\\.[A-Za-z0-9_-]{20,255}\\.[A-Za-z0-9_-]{40,255})\\b"
            ]
        },
        "actions": {
            "clean": "block",
            "strict": "block",
            "compliance": "block"
        },
        "reason": "A provider access token must not enter Git history.",
        "remediation": [
            "Remove the token from the index, revoke or rotate it, and use the provider's secret store."
        ]
    }
]
